code,describe
011,谷物种植指以收获籽实为主，供人类食用的农作物的种植，如稻谷、小麦、玉米等农作物的种植。稻谷种植包括对下列稻谷的种植活动：—早籼稻：种用早籼稻、其他早籼稻；—晚籼稻：种用晚籼稻、其他晚籼稻；—中籼稻：种用中籼稻、其他中籼稻；—粳稻：种用粳稻、其他粳稻；—糯稻：种用糯稻、其他糯稻；—其他稻谷：稻谷壳、稻谷秸及其他未列明稻谷。小麦种植包括对下列小麦的种植活动：—硬质小麦：种用硬质小麦、其他硬质小麦；—软质小麦：种用软质小麦、其他软质小麦；—混合小麦：种用混合小麦、其他混合小麦；—其他小麦：麦秸及其他未列明小麦。玉米种植包括对下列玉米的种植活动：—白玉米：种用白玉米、其他白玉米；—黄玉米：种用黄玉米、其他黄玉米；—糯玉米：种用糯玉米、其他糯玉米；—甜玉米：种用甜玉米、其他甜玉米；—其他玉米：玉米秸及其他未列明玉米。其他谷物种植包括对下列谷物的种植活动：—谷子：硬谷子、糯谷子、其他谷子；—高粱：红粒高粱（种用红粒高粱、其他红粒高粱）、白粒高粱（种用白粒高粱、其他白粒高粱）、糯高粱（种用糯高粱、其他糯高粱）、其他高粱（其他种用高粱、其他未列明高粱）；—大麦：裸大麦（种用裸大麦、其他裸大麦）、皮大麦（种用皮大麦、其他皮大麦）；—燕麦：裸燕麦、皮燕麦；—黑麦；—荞麦：甜荞麦、苦荞麦；—作物茎、秆、根（部分）：稻草、谷壳、谷子秸、高粱秸；—其他谷物：莜麦、元麦、青稞、糜子（硬糜子、糯糜子）、黍子、紫米、薏苡、其他未列明谷物。
012,豆类、油料和薯类种植豆类种植包括对下列豆类的种植活动：—大豆：黄大豆、黑大豆、青大豆、褐红大豆、双青豆、青仁乌豆、小黑豆、其他大豆；—绿豆：明绿豆（种用明绿豆、其他明绿豆）、毛绿豆（种用毛绿豆、其他毛绿豆）；—小豆：红小豆、灰白小豆、狸小豆、其他小豆；—干豌豆：白豌豆（种用白豌豆、其他白豌豆）、绿豌豆（种用绿豌豆、其他绿豌豆）、麻豌豆（种用麻豌豆、其他麻豌豆）；—干蚕豆：种用干蚕豆、其他干蚕豆；—芸豆：种用芸豆、其他芸豆；—饭豆：种用饭豆、其他饭豆；—干豇豆：种用干豇豆、其他干豇豆；—鹰嘴豆：种用鹰嘴豆、其他鹰嘴豆；—豆类蔬菜（部分）：豌豆、蚕豆；—大豆秸；—其他杂豆：种用杂豆、其他未列明杂豆。油料种植包括对下列油料的种植活动：—花生：带壳花生（种用带壳花生、其他带壳花生）、花生仁；—油菜籽：双低油菜籽（种用双低油菜籽、其他双低油菜籽）、其他油菜籽（其他种用油菜籽、其他未列明油菜籽）；—葵花籽：油葵（种用油葵、其他油葵）、食葵（种用食葵、其他食葵）；—芝麻：白芝麻（种用白芝麻、其他白芝麻）、黑芝麻（种用黑芝麻、其他黑芝麻）、黄芝麻（种用黄芝麻、其他黄芝麻）；—胡麻籽：种用胡麻籽、其他胡麻籽；—棉籽：种用棉籽、其他棉籽；—蓖麻籽：种用蓖麻籽、其他蓖麻籽；—芥子：种用芥子、其他芥子；—红花籽：种用红花籽、其他红花籽；—罂粟子；—作物茎、秆、根（部分）：花生蔓、油菜籽秆、芝麻秆、向日葵秆；—其他油料。薯类种植包括对下列薯类的种植活动：—马铃薯：种用马铃薯、其他马铃薯；—木薯：鲜木薯、木薯干、其他木薯；—甘薯：种用甘薯、甘薯干、其他鲜甘薯；—薯藤；—其他薯类。
013,棉、麻、糖、烟草种植棉花种植包括对下列棉花的种植活动：—籽棉；—棉花秆；—其他棉花。麻类种植包括对下列麻类的种植活动：—生亚麻；—生苎麻；—生黄红麻；—生线麻；—生苘麻；—生大麻；—生剑麻；—麻秆；—其他生麻。糖料种植指用于制糖甘蔗和甜菜种植。包括对下列糖料的种植活动：—甘蔗；—甜菜；—其他糖料。烟草种植包括对下列烟草的种植活动：—未去梗烤烟叶；—未去梗晒烟叶；—未去梗晾烟叶；—未去梗白肋烟；—烟秆；—其他未加工烟草。
014,蔬菜、食用菌及园艺作物种植蔬菜种植包括对下列蔬菜的种植活动：—叶菜类蔬菜：芹菜、油菜、菠菜、苋菜、空心菜、香菜、茼蒿、小白菜、冬寒菜、木耳菜、茴香、其他叶菜类蔬菜；—白菜类蔬菜：大白菜、普通白菜、乌榻菜、菜心（菜薹）、紫菜薹；—芥菜类蔬菜：叶用芥菜、茎用芥菜、根用芥菜；—甘蓝类蔬菜：结球甘蓝、菜花、花椰菜、青花菜、抱子甘蓝、球茎甘蓝、芥蓝；—根茎类蔬菜：白萝卜、红萝卜、胡萝卜、水萝卜、生姜、榨菜头、芋头、百合、山药、牛蒡、魔芋、其他根茎类蔬菜；—瓜菜类蔬菜：黄瓜、冬瓜、西葫芦、苦瓜、南瓜、佛手瓜、丝瓜、瓠瓜、其他瓜类蔬菜；—豆类蔬菜：扁豆、干扁豆、荚豆、豇豆、四季豆、毛豆、其他豆类蔬菜；—茄果类蔬菜：茄子、青椒、辣椒、西红柿、其他茄果类蔬菜；—莴苣及菊苣类蔬菜：生菜、结球莴苣（包心生菜）、莴笋、其他莴苣及菊苣类蔬菜；—葱蒜类蔬菜：洋葱、大葱、细香葱、薤菜、大蒜、蒜苗、蒜苔、蒜头、韭菜、其他葱蒜类蔬菜；—水生蔬菜：莲藕、荸荠、慈姑、莼菜、水芹、菱角、茭白、其他水生蔬菜；—养植蔬菜及其他蔬菜：豌豆苗、豆芽菜、黄花、香椿、竹笋、芦笋、金针菜、黄秋葵、其他未列明蔬菜；—蔬菜籽。不包括：—用作水果的瓜果类种植，如西瓜、白兰瓜、香瓜等，列入（仁果类和核果类水果种植）、（葡萄种植）、（柑橘类种植）、（香蕉等亚热带水果种植）、（其他水果种植）、（坚果种植）、（含油果种植）等相关类别中。食用菌种植包括对下列食用菌的种植活动：—平菇；—金针菇；—双孢蘑菇；—鸡腿菇；—杏鲍菇；—茶树菇；—滑菇；—草菇；—猴头菌；—香菇；—竹荪；—黑木耳；—黄背木耳；—白木耳；—松茸；—榛蘑；—灰树花；—其他食用菌。不包括：—野生菌类的采集，分别列入（非木竹材林产品采集）。花卉种植包括对下列花卉的种植活动：—盆栽花：孤挺花、银莲花（鳞茎类）、美人蕉、窄叶小草、铃兰、藏红花、仙客来、大丽花、独尾草、小苍兰、盆栽贝母、雪花莲、大岩桐、风信子、鸢尾、观音兰、水仙头、水仙花、虎眼万年青、酢浆草、晚香玉、毛茛、茜草、老虎莲、郁金香、杜鹃、盆栽菊花、凤梨、兰花、一品红、花烛属、君子兰、秋海棠、伽兰菜、新几内亚凤仙、仙人掌及多浆植物、花坛花卉、木本盆花、其他盆栽花；—鲜切花及花蕾：康乃馨、满天星、勿忘我、玫瑰、情人草、紫罗兰、月季、香石竹、唐菖蒲、百合花、非洲菊、补血草、马蹄莲、火鹤、其他鲜切花及花蕾；—切叶：肾蕨、散尾葵、苏铁、富贵竹、龟背竹、其他切叶；—切枝：银芽柳、其他切枝；—干燥花；—花卉种球：唐菖蒲种球、百合种球、郁金香种球、水仙种球、马蹄莲种球、大丽花种球、美人蕉种球、风信子种球、小苍兰种球、球根鸢尾种球、晚香玉种球、其他花卉种球；—花卉种子：一串红种子、矮牵牛种子、万寿菊种子、凤仙花种子、鸡冠花种子、三色堇种子、金鱼草种子、石竹种子、翠菊种子、四季秋海棠种子、其他花卉种子；—花卉种苗：香石竹种苗、菊花种苗、非洲菊种苗、月季种苗、火鹤种苗、兰花种苗、君子兰种苗、其他花卉种苗。其他园艺作物种植指盆栽观赏花木，以及用于装饰等目的的植物的种植（如草坪、草皮等）。包括对下列园艺作物的种植活动：—园艺产品：盆栽观叶植物（龙血树、马拉巴栗、喜林芋、绿萝、变叶木、袖珍椰子、盆栽散尾葵、绿巨人、花叶万年青、竹芋、白鹤芋、花叶芋、亮丝草、其他盆栽观叶植物）、草皮、草坪、其他园艺产品；—草种：苜蓿草种、箭舌豌豆草种、红豆草草种、草木犀草种、燕麦草种、多花黑麦草草种、披碱草草种、柠挑草种、沙打旺草种、锦鸡儿草种、老芒麦草种、羊柴草种、其他草种；—其他盆景及园艺产品。不包括：—树木幼苗的培育和种植，列入（林木育种）、（林木育苗）；—城市草坪的种植、管理，列入（绿化管理）。
015,水果种植仁果类和核果类水果种植指苹果、梨、桃、杏、李子等水果种植。包括对下列仁果类和核果类水果的种植活动：—苹果：红富士苹果、国光苹果、秦冠苹果、香蕉苹果、金冠苹果、元帅苹果、新红星苹果、其他苹果；—梨：雪花梨、鸭梨、酥梨、香梨、苹果梨、黄冠梨、绿宝石梨、冬果梨、贡梨、黄花梨、其他梨；—核果类水果：桃、樱桃、枣、红果、山楂、李子、石榴、杏、杨梅；—水果籽（部分）：杏核等；—农户仁果类和核果类水果种植、加工一体的果酒及水果产品的生产。不包括：—野生水果的采集，列入（非木竹材林产品采集）。葡萄种植包括对下列葡萄的种植活动：—葡萄：巨峰葡萄、玫瑰香葡萄、白葡萄、龙眼葡萄、木纳格葡萄、红提葡萄、酿造葡萄、其他葡萄；—葡萄籽；—农户葡萄种植、加工一体的葡萄酒生产及葡萄产品加工。不包括：—野生水果的采集，列入（非木竹材林产品采集）。柑橘类种植包括对下列柑橘类的种植活动：—柑橘；—橙；—宽皮柑橘；—柚类；—金柑；—柚子；—柠檬；—其他柑橘类水果。不包括：—野生水果的采集，列入（非木竹材林产品采集）。香蕉等亚热带水果种植指香蕉、菠萝、芒果等亚热带水果种植。包括对下列亚热带水果的种植活动：—香蕉；—菠萝；—龙眼；—荔枝；—枇杷；—红毛丹；—芒果；—橄榄；—无花果；—鳄梨；—番石榴；—山竹果；—杨桃；—莲雾；—火龙果；—其他亚热带水果；—农户亚热带水果种植、加工一体的果酒及水果产品的生产。不包括：—野生水果的采集，列入（非木竹材林产品采集）。其他水果种植包括对下列水果的种植活动：—瓜类水果：西瓜、哈蜜瓜、华莱士瓜、香瓜、伊利沙白瓜、金瓜、木瓜、其他瓜类水果；—其他水果：柿子、草莓、黑莓、桑椹、猕猴桃、沙棘、其他未列明水果；—其他水果籽；—农户其他水果种植、加工一体的果酒及其他水果产品的生产。不包括：—野生水果的采集，列入（非木竹材林产品采集）。
016,坚果、含油果、香料和饮料作物种植坚果种植包括对下列坚果的种植活动：—椰子：种用椰子、其他椰子；—腰果；—核桃；—山核桃；—栗子：板栗、锥栗、丹东栗、其他栗子；—松子；—榛子；—阿月浑子果（开心果）；—槟榔；—白果；—香榧；—巴旦杏；—夏威夷果；—其他坚果；—农户坚果种植、加工一体的果酒及坚果产品的生产。不包括：—坚果的采集，列入（非木竹材林产品采集）。含油果种植指橄榄、油棕榈等的种植。包括对下列含油果的种植活动：—油棕果及油棕仁：种用油棕果及油棕仁、其他油棕果及油棕仁；—油橄榄果。不包括：—野生含油果的采集，列入（非木竹材林产品采集）。香料作物种植包括对下列香料作物的种植活动：—调味香料：花椒、胡椒、八椒、桂皮、桂花、丁香、豆蔻、小茴香、咖喱、枯茗子、蒿子、杜松果、其他调味香料；—香味料：香子兰、香茅草、薄菏油、留兰香、啤酒花、番红花、姜黄、麝香草、月桂叶、其他香味料。不包括：—香料的提取和制造等活动，列入（香料、香精制造）。茶及其他饮料作物种植包括对下列茶及其他饮料作物的种植活动：—茶叶：红茶、绿茶、白茶、黄茶、清茶（铁观音、乌龙茶、其他清茶）、黑茶（普洱茶、其他黑茶）、再加工茶（银杏茶、其他再加工茶、其他茶叶）；—其他饮料原料：可可豆、咖啡豆、其他未列明饮料原料。不包括：—茶叶的精加工，列入（精制茶加工）；—可可和咖啡的精加工，列入（固体饮料制造）。
017,中药材种植指主要用于中药配制以及中成药加工的药材作物的种植。包括对下列中药材的种植活动：—各种中草药材：甘草、人参、古柯叶、罂粟秆、当归、田七、党参、黄连、菊花、冬虫夏草、贝母、川芎、半夏、白芍、天麻、黄芪、大黄、籽黄、白术、地黄、槐米、杜仲、茯苓、枸杞、大海子、沉香、沙参、青蒿、鱼藤根、除虫菊、灵芝、五味子、刺五加、生地、麦冬、云木香、白芷、元胡、山茱萸、莲翘、辛荑、厚朴、黄芩、葛根、柴胡、麻黄、列当、肉苁蓉、锁阳、罗布麻、其他中草药材。不包括：—用于杀虫和杀菌目的植物的种植，列入（其他农业）。
019,其他农业指上述未列明的农作物种植。包括用于杀菌和杀虫作物的种植，以及染料作物、绿肥作物、饲料作物、水生植物种植和野生植物采集。包括对下列其他农业作物的种植活动：—苜蓿；—青饲料；—饲料牧草：苜蓿干草、羊草、沙打旺、其他饲料牧草；—饲料作物用种子；—其他饲料作物；—芦苇；—席草；—苇子；—莲子；—蒲草；—慈姑；—其他水生植物类；—其他作物茎、杆、根；—其他农作物副产品。不包括：—野生林产品的采集，列入（非木竹材林产品采集）；—中药材的种植，列入（中药材种植）。
021,林木育种和育苗林木育种指应用遗传学原理选育和繁殖林木新品种核心的栽植材料的林木遗传改良活动。包括对下列林木的育种活动：—针叶乔木树种种子：杉树种子、柏树种子、松树种子、银杏种子、其他针叶乔木树种种子；—阔叶乔木树种种子：槭树类种子、枫树类种子、冬青树类种子、桦树类种子、木棉树类种子、榛树类种子、榆树类种子、楠木类种子、樟树类种子、相思类种子、壳斗科类种子、其他阔叶乔木树种种子；—灌木种子：蕃荔枝类灌木种子、夹竹桃类灌木种子、冬青类灌木种子、小檗类灌木种子、榛树类灌木种子、胡枝子灌木种子、沙棘类灌木种子、马棘类灌木种子、其他灌木种子；—藤木种子：棕榈藤种子、其他藤木种子；—其他林木种子。林木育苗指通过人为活动将种子、穗条或植物其他组织培育成苗木的活动。包括对下列林木的育苗活动：—针叶乔木苗类：杉树树苗、柏树树苗、松树树苗、银杏树苗、其他针叶乔木树苗；—阔叶乔木苗类：槭树类树苗、枫树类树苗、冬青树类树苗、桦树类树苗、木棉树类树苗、榛树类树苗、杨树类树苗、柳树类树苗、樟树类树苗、楠木类树苗、榆树类树苗、桂花树苗、相思类树苗、壳斗科类树苗、其他阔叶乔木树苗；—果树苗：苹果树苗、梨树苗、葡萄树苗、柑橘树苗、桃树苗、其他果树苗；—竹苗：毛竹苗、撑蒿竹苗、水竹苗、淡竹苗、慈竹苗、红壳竹苗、绿竹苗、其他竹苗；—灌木树苗：蕃荔枝类灌木树苗、夹竹桃类灌木树苗、冬青类灌木树苗、小檗类灌木树苗、桦木及杨树类灌木树苗、其他灌木树苗；—其他林木养育。
022,造林和更新指在宜林荒山荒地荒沙、采伐迹地、火烧迹地、疏林地、灌木林地等一切可造林的土地上通过人工造林、人工更新、封山育林、飞播造林等方式培育和恢复森林的活动。包括对下列造林和更新活动：—人工造林服务；—飞播造林服务；—其他造林服务。不包括：—补植、经济林复垦、低产林改造、迹地更新等活动，列入（森林经营和管护）。
023,森林经营和管护指为促进林木生长发育，在林木生长的不同时期进行的促进林木生长发育的活动。包括对下列森林经营和管护的活动：—对人工的和天然的幼龄林、中龄林、近熟林和成熟林进行的各种抚育和管理活动（如对林木的中耕、松土、培土、除草、补植、灌溉、间伐、抚育采伐、修枝、人工施肥等活动）；—其他林木抚育管理服务。
024,木材和竹材采运指对林木和竹木的采伐，并将其运出山场至贮木场的生产活动。木材采运指林木砍伐，对伐倒林木的简单加工活动（如林木的去枝、打叶、造材），与木材采伐相关的运输活动，以及砍伐林木的堆放、涂抹杀虫剂和防腐处理等活动。包括对下列木材的采运活动：—针叶原木：红松原木、樟子松原木、白松（云杉和冷杉）原木、辐射松原木、落叶松原木、马尾松原木、云南松原木、杉木原条、其他针叶原木；—非针叶原木：栎木（橡木）原木、山毛榉木原木、楠木原木、樟木原木、泡桐木原木、杨树原木、水曲柳原木、胡桃楸原木、柞木原木、桦木原木、榆木原木、柳木原木、椴木原木、桉树原木、其他非针叶原木；—小规格木材：针叶木小规格木材、其他木小规格木材；—薪材；—短条及细枝等。不包括：—独立的木材运输活动，列入G（交通运输、仓储和邮政业）的相关行业类别中；—木材的加工，列入（木材加工和木、竹、藤、棕、草制品业）的相关行业类别中。竹材采运指竹材砍伐，对竹材简单加工等活动（如竹材的去枝、打叶、切割等），与竹材采伐相关的运输活动，以及竹材的堆放、贮存、涂抹杀虫剂和防腐处理等活动。包括对下列竹材的采运活动：—砍伐的竹材：毛竹、撑蒿竹、水竹、淡竹、慈竹、红壳竹、其他竹材；—林区竹材运输服务；—其他竹材采伐产品。不包括：—独立的竹材运输活动，列入G（交通运输、仓储和邮政业）的相关行业类别中；—竹材的加工，列入（木材加工和木、竹、藤、棕、草制品业）的相关行业类别中。
025,林产品采集指在天然林地和人工林地进行的各种林木产品和其他野生植物的采集等活动。木竹材林产品采集指在天然森林和人工林地进行的各种林木产品和其他野生植物的采集活动。包括对下列木竹材林产品的采集活动：—木竹编结用原料：藤条、柳条、柠条、荆条、桑条；—木竹野生植物活体：野生乔木、野生灌木、野生藤木、野生菌类。非木竹材林产品采集指在天然林地和人工林地进行的除木材、竹材产品外的其他各种林产品的采集活动。包括对下列非木竹材林产品的采集活动：—天然橡胶：天然橡胶乳、烟胶片、胶清片、白皱片、褐胶片、标准胶片、其他天然橡胶；—天然树脂、树胶：天然生漆、天然松脂、虫胶、桃胶、冷杉胶、其他天然树脂、树胶；—栲胶原料：落叶松树皮、杨梅树皮、油柑树皮、檞树皮、木麻黄树皮、黑荆树皮、橡碗、化香果、其他栲胶原料；—非直接食用果类：油桐籽、油茶籽、沙棘果、乌桕子、文冠果、山苍籽、黑椋子、麻风树果（小桐子）、黄连木果、光皮梾（光皮树）果、其他非直接食用果类；—非木竹编结用原料：灯心草、菖蒲、葵叶、其他编织用原料；—染色、鞣革用植物原料：五倍子、地衣、蓝靛、薯茛、其他染色、鞣革用植物原料；—非木竹野生植物活体：野生蕨菜、野生发菜、野生薇菜、野生锁阳、其他野生植物活体；—野生植物采集产品：野生植物根、野生植物茎、野生植物叶、野生植物花、野生植物果实、其他野生植物采集产品；—其他林产品：未加工天然软木、棕片、竹笋干、黄柏桕、山苍子、桉树叶、其他未列明林产品。不包括：—咖啡、可可等饮料作物的采集，列入（香料作物种植）。
031,牲畜饲养牛的饲养包括对下列牛的饲养活动：—牛：种牛、黄牛、水牛、奶牛、牦牛、牛犊、能繁殖母牛、其他牛；—生牛奶；—同一农（牧）场或农户生产加工的生牛奶以及奶酪、黄油等；—同一农（牧）场或农户生产加工的牛毛；—牦牛毛（牦牛绒）。马的饲养包括对下列马的饲养活动：—马：种马、马驹、其他马；—马毛：马鬃、马尾、其他马毛；—生马奶；—同一农（牧）场或农户生产加工的生马奶；—同一农（牧）场或农户生产加工的马毛；—整张生马皮。猪的饲养包括对下列猪的饲养活动：—猪：种猪、仔猪、中猪、能繁殖母猪、其他猪；—生皮（部分）：整张生猪皮；—猪鬃。羊的饲养包括对下列羊的饲养活动：—绵羊：细毛羊、半细毛羊、种绵羊、能繁殖母绵羊、其他绵羊；—山羊：种山羊、奶山羊、种绒山羊、绒山羊、能繁殖母山羊、其他山羊；—能繁殖母羊；—羔羊；—绵羊毛（部分）：细羊毛、半细羊毛、剪羊毛；—山羊绒；—整张羔羊生毛皮；—制刷用山羊毛；—同一农（牧）场或农户生产加工的生羊奶；—同一农（牧）场或农户生产加工的绵羊毛、山羊毛、制刷用山羊毛，以及羔羊整张毛皮。骆驼饲养包括对下列骆驼的饲养活动：—骆驼；—骆驼毛：骆驼粗毛、骆驼绒；—同一农（牧）场或农户生产加工的骆驼毛。其他牲畜饲养包括对下列牲畜的饲养活动：—驴：种驴、其他驴；—骡；—其他活牲畜；—同一农（牧）场或农户生产加工的其他牲畜毛。
032,家禽饲养鸡的饲养包括对下列鸡的饲养活动：—蛋鸡：种蛋鸡、其他蛋鸡；—雏鸡：种雏鸡、其他雏鸡；—肉鸡：种肉鸡、其他肉鸡；—其他活鸡：其他种用活鸡、其他未列明活鸡；—鸡蛋：种用鸡蛋、其他鲜鸡蛋。不包括：—火鸡、珍珠鸡等饲养，列入（其他家禽饲养）；—山鸡的饲养，列入（其他畜牧业）。鸭的饲养包括对下列鸭的饲养活动：—雏鸭：种用雏鸭、其他雏鸭；—成鸭：种用成鸭、其他成鸭；—鸭蛋：种用鸭蛋、其他鲜鸭蛋。鹅的饲养包括对下列鹅的饲养活动：—雏鹅：种用雏鹅、其他雏鹅；—成鹅：种用成鹅、其他成鹅；—鹅蛋：种用鹅蛋、其他鲜鹅蛋。其他家禽饲养包括对下列家禽的饲养活动：—活火鸡：雏火鸡（种用雏火鸡、其他雏火鸡）、成火鸡（种用成火鸡、其他成火鸡）；—活珍珠鸡：雏珍珠鸡（种用雏珍珠鸡、其他雏珍珠鸡）、成珍珠鸡（种用成珍珠鸡、其他成珍珠鸡）；—其他活家禽：鸽子、鸵鸟、野鸭、鹌鹑、其他未列明活家禽；—禽蛋（部分）：鹌鹑蛋（种用鹌鹑蛋、其他鲜鹌鹑蛋）、其他禽蛋。不包括：—鸟类的饲养，列入（其他畜牧业）；—孔雀等的饲养，列入（其他畜牧业）。
033,狩猎和捕捉动物包括农户、牧民、农（牧）场、合作社、其他农业（畜牧）生产单位或其他相关单位所从事的以下狩猎和动物捕捉活动：包括下列狩猎和捕捉动物的活动：—为动物园和供观赏等目的捕获动物的活动；—野生动物：野兔、狐狸、其他野生动物；—野生鸟类：水禽、雉鸡、野鸡、其他野生鸟类；—爬行动物：食用爬行动物、其他爬行动物；—来自猎取和捕捉活动中的兽皮和爬行动物、鸟类毛皮等的生产；—整张爬行动物皮；—整张狐生毛皮；—其他捕获野生动物和有关的服务活动。不包括：—动物园、野生动物园的活动，观赏动物的饲养，野生动物保护的活动，列入（野生动物保护）；—专门供运动和休闲的动物捕捉等有关的活动，列入（休闲健身活动）。
